da,delex_da,text,delex_text
?request(price_range),?request(price_range),Jakou cenovou kategorii hledáte ?,Jakou cenovou kategorii hledáte ?
"inform(area=Nusle,name=Místo)","inform(area=X-area,name=X-name)",Do restaurace Místo musíte vyrazit do Nuslí .,Do restaurace X-name musíte vyrazit do X-area .
?reqmore(),?reqmore(),Mohu vám poskytnout nějaké další informace ?,Mohu vám poskytnout nějaké další informace ?
goodbye(),goodbye(),Nashle !,Nashle !
goodbye(),goodbye(),"Děkuji Vám , mějte se krásně .","Děkuji Vám , mějte se krásně ."
"inform(name='Pivo & Basilico',type=restaurant)","inform(name=X-name,type=restaurant)",Našla jsem restauraci jménem Pivo & Basilico,Našla jsem restauraci jménem X-name
?reqmore(),?reqmore(),Jak vám mohu pomoci ?,Jak vám mohu pomoci ?
"inform(address='Tržiště 4',name=Místo)","inform(address=X-address,name=X-name)",Restaurace jménem Místo se nachází na adrese Tržiště 4 .,Restaurace jménem X-name se nachází na adrese X-address .
"inform(name='Green Spirit',phone=276856174,price='between 290 and 440 Kč')","inform(name=X-name,phone=X-phone,price=X-price)",Restaurace Green Spirit nabízí jídla od 290 do 440 Kč a kontaktovat ji můžete na telefonním čísle 276856174 .,Restaurace X-name nabízí jídla X-price a kontaktovat ji můžete na telefonním čísle X-phone .
goodbye(),goodbye(),Děkuji . Zase někdy na shledanou .,Děkuji . Zase někdy na shledanou .
goodbye(),goodbye(),Bylo mi potěšením . Na shledanou .,Bylo mi potěšením . Na shledanou .
goodbye(),goodbye(),"Snad jsem pomohla , na shledanou .","Snad jsem pomohla , na shledanou ."
"inform(food=German,name=Ferdinanda)","inform(food=X-food,name=X-name)",Ferdinanda je dobrá německá restaurace .,X-name je dobrá X-food restaurace .
"inform(name=Ananta,price='70 Kč')","inform(name=X-name,price=X-price)",Ceny v restauraci Ananta se pohybují 70 Kč .,Ceny v restauraci X-name se pohybují X-price .
"inform(name='U Konšelů',price='220 Kč')","inform(name=X-name,price=X-price)",Typická cena v restauraci U Konšelů je 220 Kč .,Typická cena v restauraci X-name je X-price .
"inform(name='Café Kampus',type=restaurant)","inform(name=X-name,type=restaurant)",Mám tu restauraci Café Kampus .,Mám tu restauraci X-name .
?request(price_range),?request(price_range),Kolik přibližně máte v plánu utratit ?,Kolik přibližně máte v plánu utratit ?
goodbye(),goodbye(),"Děkuju Vám , na shledanou .","Děkuju Vám , na shledanou ."
"inform(food=Asian,name='U Tučňáků',near='Wenceslas Square')","inform(food=X-food,name=X-name,near=X-near)","Blízko Václavského náměstí je restaurace U Tučňáků , která nabízí asijská jídla .","Blízko X-near je restaurace X-name , která nabízí X-food jídla ."
"inform(food=Turkish,name='Švejk Restaurant',near='Old Town Square')","inform(food=X-food,name=X-name,near=X-near)","Mám tady restauraci jménem Švejk Restaurant , která nabízí turecká jídla blízko Staroměstského náměstí .","Mám tady restauraci jménem X-name , která nabízí X-food jídla blízko X-near ."
goodbye(),goodbye(),Jste určitě vítáni !,Jste určitě vítáni !
"inform(address='Karmelitská 27',name='Švejk Restaurant',price='70 Kč')","inform(address=X-address,name=X-name,price=X-price)",Restaurace Švejk leží na adrese Karmelitská 27 . Běžné jídlo zde stojí 70 Kč .,X-name leží na adrese X-address . Běžné jídlo zde stojí X-price .
"inform_only_match(good_for_meal=brunch,name='U Konšelů',price_range=cheap)","inform_only_match(good_for_meal=X-good_for_meal,name=X-name,price_range=X-price_range)","Omlouvám se , U Konšelů je jediná dostupná restaurace , která nabízí brunch v levné cenové kategorii","Omlouvám se , X-name je jediná dostupná restaurace , která nabízí X-good_for_meal v X-price_range cenové kategorii"
"inform(food=Chinese,name='Švejk Restaurant')","inform(food=X-food,name=X-name)","V této čtvrti najdete restauraci Švejk , která vaří čínskou kuchyni .","V této čtvrti najdete X-name , která vaří X-food kuchyni ."
"inform(food=Chinese,kids_allowed=yes,name='Café Kampus',price_range=cheap)","inform(food=X-food,kids_allowed=yes,name=X-name,price_range=X-price_range)","A co takhle Café Kampus ? Patří k těm levnějším , podává čínskou kuchyni a je vhodná pro děti .","A co takhle X-name ? Patří k těm X-price_range , podává X-food kuchyni a je vhodná pro děti ."
goodbye(),goodbye(),Na slyšenou !,Na slyšenou !
?request(price_range),?request(price_range),Jaká cenová kategorie je pro Vás přijatelná ?,Jaká cenová kategorie je pro Vás přijatelná ?
"inform(food=Mexican,name='Café Savoy')","inform(food=X-food,name=X-name)",Café Savoy nabízí mexická jídla .,X-name nabízí X-food jídla .
"inform(address='Újezd 50',area=Nusle,name='Pivo & Basilico')","inform(address=X-address,area=X-area,name=X-name)","Adresa Piva & Basilica je Újezd 50 , Nusle .","Adresa X-name je X-address , X-area ."
"inform(address='Tržiště 32',name='Green Spirit')","inform(address=X-address,name=X-name)",Green Spirit máte na adrese Tržiště 32 .,X-name máte na adrese X-address .
?request(price_range),?request(price_range),Jakou cenovou skupinu u restaurace požadujete ?,Jakou cenovou skupinu u restaurace požadujete ?
goodbye(),goodbye(),"Užijte si večeři a doufám , že vám budu moci pomoct znovu .","Užijte si večeři a doufám , že vám budu moci pomoct znovu ."
?reqmore(),?reqmore(),Chcete vědět ještě něco dalšího ?,Chcete vědět ještě něco dalšího ?
goodbye(),goodbye(),Mějte se .,Mějte se .
"inform(food=Chinese,good_for_meal=lunch,name='Švejk Restaurant')","inform(food=X-food,good_for_meal=X-good_for_meal,name=X-name)",Švejk Restaurant podává k obědu čínské pokrmy .,X-name podává k X-good_for_meal X-food pokrmy .
"inform(name='U Konšelů',type=restaurant)","inform(name=X-name,type=restaurant)",Podnik U Konšelů je restaurace .,Podnik X-name je restaurace .
"inform_only_match(area=Hradčany,name='Kočár z Vídně')","inform_only_match(area=X-area,name=X-name)","Omlouvám se , jediná restaurace na Hradčanech je Kočár z Vídně .","Omlouvám se , jediná restaurace na X-area je X-name ."
"inform(name='Café Savoy',type=restaurant)","inform(name=X-name,type=restaurant)",Café Savoy je jedna restaurace .,X-name je jedna restaurace .
"inform(address='Tržiště 37',name='Green Spirit',phone=244302236)","inform(address=X-address,name=X-name,phone=X-phone)","Green Spirit sídlí na adrese Tržiště 37 , telefonní číslo je 244302236 .","X-name sídlí na adrese X-address , telefonní číslo je X-phone ."
"inform(food=Mexican,name='Green Spirit')","inform(food=X-food,name=X-name)",Green Spirit vaří mexickou kuchyni,X-name vaří X-food kuchyni
"inform(kids_allowed=yes,name='U Konšelů',phone=215370369)","inform(kids_allowed=yes,name=X-name,phone=X-phone)","Restauraci U Konšelů můžete kontaktovat na čísle 215370369 . Ano , děti jsou zde vítány .","Restauraci X-name můžete kontaktovat na čísle X-phone . Ano , děti jsou zde vítány ."
"inform(good_for_meal=dinner,name=Místo,near='Old Town Square',price_range=moderate)","inform(good_for_meal=X-good_for_meal,name=X-name,near=X-near,price_range=X-price_range)",V restauraci Místo poblíž Staroměstského náměstí povečeříte za přijatelnou cenu .,V restauraci X-name poblíž X-near X-good_for_meal za X-price_range cenu .
goodbye(),goodbye(),Na slyšenou příště .,Na slyšenou příště .
"inform_only_match(food=French,name=BarBar)","inform_only_match(food=X-food,name=X-name)","Omlouvám se , zkontrolovala jsem , že zde nejsou další francouzské restaurace kromě BarBaru .","Omlouvám se , zkontrolovala jsem , že zde nejsou další X-food restaurace kromě X-name ."
"inform(address='Újezd 8',name='Baráčnická rychta')","inform(address=X-address,name=X-name)",Restauraci Baráčnická rychta najdete na Újezdě 8 .,Restauraci X-name najdete na X-address .
?request(price_range),?request(price_range),Můžete prosím upřesnit cenovou skupinu ?,Můžete prosím upřesnit cenovou skupinu ?
goodbye(),goodbye(),Nashle !,Nashle !
"inform(area=Karlín,name='Café Kampus')","inform(area=X-area,name=X-name)",Café Kampus je příjemná restaurace na Karlíně .,X-name je příjemná restaurace na X-area .
?request(price_range),?request(price_range),Jakou kategorii cen hledáte ?,Jakou kategorii cen hledáte ?
"inform(food=Italian,good_for_meal=lunch,name='Kočár z Vídně')","inform(food=X-food,good_for_meal=X-good_for_meal,name=X-name)",Restaurace Kočár z Vídně je dobré místo pro italskou kuchyni a na oběd .,Restaurace X-name je dobré místo pro X-food kuchyni a na X-good_for_meal .
"inform(name='Café Kampus',type=restaurant)","inform(name=X-name,type=restaurant)",Našla jsem dobrou restauraci jménem Café Kampus,Našla jsem dobrou restauraci jménem X-name
"inform(good_for_meal=dinner,kids_allowed=yes,name='Švejk Restaurant',price_range=expensive)","inform(good_for_meal=X-good_for_meal,kids_allowed=yes,name=X-name,price_range=X-price_range)","Další restaurace je Švejk Restaurant . Je vstřícný k dětem , drahý a podává večeře .","Další restaurace je X-name . Je vstřícný k dětem , X-price_range a podává X-good_for_meal ."
goodbye(),goodbye(),"Nemáte zač , tak na shledanou .","Nemáte zač , tak na shledanou ."
goodbye(),goodbye(),Děkuji vám . Na shledanou .,Děkuji vám . Na shledanou .
goodbye(),goodbye(),"Na shledanou , děkujeme za využití našich služeb .","Na shledanou , děkujeme za využití našich služeb ."
?request(price_range),?request(price_range),Jakou cenovou relaci preferujete ?,Jakou cenovou relaci preferujete ?
"inform(address='Újezd 33',name='Švejk Restaurant')","inform(address=X-address,name=X-name)",Adresa podniku Restaurace Švejk je Újezd 33 .,Adresa podniku X-name je X-address .
?request(price_range),?request(price_range),Můžete upřesnit cenovou kategorii ?,Můžete upřesnit cenovou kategorii ?
?confirm(price_range=cheap),?confirm(price_range=X-price_range),Přejete si levnou restauraci ?,Přejete si X-price_range restauraci ?
?request(good_for_meal),?request(good_for_meal),"Jaké jídlo hledáte , snídani , brunch , oběd nebo večeři ?","Jaké jídlo hledáte , snídani , brunch , oběd nebo večeři ?"
"inform(count=218,food=dont_care,price_range=dont_care,type=restaurant)","inform(count=X-count,food=dont_care,price_range=dont_care,type=restaurant)","Pokud vám nezáleží na druhu jídla , našla jsem 218 restaurací v různých cenových skupinách .","Pokud vám nezáleží na druhu jídla , našla jsem X-count restaurací v různých cenových skupinách ."
?request(price_range),?request(price_range),Jaká cenová kategorie je pro Vás přijatelná ?,Jaká cenová kategorie je pro Vás přijatelná ?
?request(price_range),?request(price_range),Jakou cenovou kategorii hledáte ?,Jakou cenovou kategorii hledáte ?
?request(price_range),?request(price_range),Jakou cenovou kategorii preferujete ?,Jakou cenovou kategorii preferujete ?
goodbye(),goodbye(),Děkuji a přeji hezký den .,Děkuji a přeji hezký den .
"inform(food=French,good_for_meal=dinner,name=Ferdinanda,near='Old Town Square')","inform(food=X-food,good_for_meal=X-good_for_meal,name=X-name,near=X-near)","Poblíž Staroměstského náměstí je příjemná restaurace Ferdinanda , která vaří francouzská jídla a hodí se na večeři .","Poblíž X-near je příjemná restaurace X-name , která vaří X-food jídla a hodí se na X-good_for_meal ."
"inform(kids_allowed=no,name=BarBar,near='Prague Castle',price_range=expensive)","inform(kids_allowed=no,name=X-name,near=X-near,price_range=X-price_range)","BarBar je luxusní restaurace nedaleko od Pražského hradu , která je nepřístupná dětem .","X-name je X-price_range restaurace nedaleko od X-near , která je nepřístupná dětem ."
"inform(food=Chinese,name=Místo)","inform(food=X-food,name=X-name)","Místo je příjemná restaurace , kde mají čínskou kuchyni .","X-name je příjemná restaurace , kde mají X-food kuchyni ."
goodbye(),goodbye(),Děkuji za zavolání . Na shledanou .,Děkuji za zavolání . Na shledanou .
goodbye(),goodbye(),"Na shledanou , přeji Vám krásný den .","Na shledanou , přeji Vám krásný den ."
"inform(name=Místo,type=restaurant)","inform(name=X-name,type=restaurant)",Mám tu příjemnou restauraci Místo .,Mám tu příjemnou restauraci X-name .
inform_no_match(area='Žižkov or Vinohrady'),inform_no_match(area=X-area),"Lituji , ale na Žižkově nebo Vinohradech se nenachází žádné restaurace .","Lituji , ale na X-area se nenachází žádné restaurace ."
?request(near),?request(near),Poblíž čeho se to nachází ?,Poblíž čeho se to nachází ?
goodbye(),goodbye(),Není zač .,Není zač .
?request(price_range),?request(price_range),"Mohu potvrdit , že požadujete konkrétní cenovou kategorii ?","Mohu potvrdit , že požadujete konkrétní cenovou kategorii ?"
"inform(address='Náprstkova 14',name=Ferdinanda)","inform(address=X-address,name=X-name)",Restauraci Ferdinanda najdete na adrese Náprstkova 14 .,Restauraci X-name najdete na adrese X-address .
"inform(food=Asian,good_for_meal=lunch,name=Ananta)","inform(food=X-food,good_for_meal=X-good_for_meal,name=X-name)","Můžete navštívit restauraci Ananta během doby obědů , pokud chcete asijské jídlo .","Můžete navštívit restauraci X-name během doby X-good_for_meal , pokud chcete X-food jídlo ."
"inform(area='Žižkov or Vinohrady',name=Ferdinanda)","inform(area=X-area,name=X-name)",Ferdinanda sídlí na Žižkově nebo Vinohradech .,X-name sídlí na X-area .
goodbye(),goodbye(),Zatím !,Zatím !
"inform(food=Mexican,name=Ferdinanda)","inform(food=X-food,name=X-name)",Restaurace Ferdinanda nabízí mexická jídla .,Restaurace X-name nabízí X-food jídla .
"inform(kids_allowed=yes,name=Místo)","inform(kids_allowed=yes,name=X-name)","Ano , do restaurace Místo můžete s dětmi .","Ano , do restaurace X-name můžete s dětmi ."
"inform_only_match(food=Turkish,good_for_meal=dinner,name='Pivo & Basilico')","inform_only_match(food=X-food,good_for_meal=X-good_for_meal,name=X-name)","Omlouvám se , není zde jiná restaurace než Pivo & Basilico , která by byla dobrá pro večeři a nabízela turecká jídla .","Omlouvám se , není zde jiná restaurace než X-name , která by byla dobrá pro X-good_for_meal a nabízela X-food jídla ."
goodbye(),goodbye(),Děkuji za zavolání . Na shledanou .,Děkuji za zavolání . Na shledanou .
"inform(address='Karmelitská 36',name='Café Savoy',postcode='138 00')","inform(address=X-address,name=X-name,postcode=X-postcode)","Café Savoy můžete najít v Karmelitské 36 , 138 00 .","X-name můžete najít v X-address , X-postcode ."
"inform(name='Green Spirit',near=Stromovka,price_range=cheap)","inform(name=X-name,near=X-near,price_range=X-price_range)",Green Spirit je v levné cenové skupině a nachází se u Stromovky .,X-name je v X-price_range cenové skupině a nachází se u X-near .
inform_no_match(area='Staré Město'),inform_no_match(area=X-area),Nemůžu najít žádné restaurace na Starém městě .,Nemůžu najít žádné restaurace na X-area .
goodbye(),goodbye(),Na shledanou . Omlouvám se .,Na shledanou . Omlouvám se .
?confirm(area=dont_care),?confirm(area=dont_care),"Mohu potvrdit , že Vám nezáleží na lokalitě ?","Mohu potvrdit , že Vám nezáleží na lokalitě ?"
"inform(kids_allowed=yes,name=Ferdinanda,price_range=cheap)","inform(kids_allowed=yes,name=X-name,price_range=X-price_range)","Ferdinanda je levná restaurace , kam je povolen vstup s dětmi .","X-name je X-price_range restaurace , kam je povolen vstup s dětmi ."
goodbye(),goodbye(),Děkuji vám . Na shledanou .,Děkuji vám . Na shledanou .
"inform(name=Místo,type=restaurant)","inform(name=X-name,type=restaurant)","Místo je krásná restaurace , která vyhovuje vašim požadavkům .","X-name je krásná restaurace , která vyhovuje vašim požadavkům ."
goodbye(),goodbye(),Moc děkuji za zavolání . Na shledanou .,Moc děkuji za zavolání . Na shledanou .
goodbye(),goodbye(),Na shledanou .,Na shledanou .
goodbye(),goodbye(),Děkuji a přeji krásný den,Děkuji a přeji krásný den
goodbye(),goodbye(),Děkuji .,Děkuji .
"inform(name='Kočár z Vídně',type=restaurant)","inform(name=X-name,type=restaurant)",Restaurace Kočár z Vídně je poblíž,Restaurace X-name je poblíž
goodbye(),goodbye(),Mějte se !,Mějte se !
?select(kids_allowed='yes or no'),?select(kids_allowed='yes or no'),"Preferujete restauraci , která povoluje nebo nepovoluje vstup s dětmi ?","Preferujete restauraci , která povoluje nebo nepovoluje vstup s dětmi ?"
?request(price_range),?request(price_range),Vyžadujete konkrétní cenovou kategorii ?,Vyžadujete konkrétní cenovou kategorii ?
"inform(count=36,kids_allowed=yes,price_range=moderate,type=restaurant)","inform(count=X-count,kids_allowed=yes,price_range=X-price_range,type=restaurant)",36 restaurací je cenově středních a přístupných dětem .,X-count restaurací je cenově X-price_range a přístupných dětem .
?request(price_range),?request(price_range),Hledáte restaurace v konkrétní cenové skupině ?,Hledáte restaurace v konkrétní cenové skupině ?
?request(price_range),?request(price_range),Jak by to mělo být cenově ?,Jak by to mělo být cenově ?
?request(good_for_meal),?request(good_for_meal),Jaké jídlo byste si dali ?,Jaké jídlo byste si dali ?
?select(kids_allowed='yes or no'),?select(kids_allowed='yes or no'),"Zajímá Vás , zda do restaurace mohou děti ?","Zajímá Vás , zda do restaurace mohou děti ?"
goodbye(),goodbye(),Děkuji . Někdy na shledanou .,Děkuji . Někdy na shledanou .
inform_no_match(area=Vinohrady),inform_no_match(area=X-area),Poblíž Vinohrad není žádná restaurace .,Poblíž X-area není žádná restaurace .
goodbye(),goodbye(),"Doufám , že jsem zodpověděla všechny vaše otázky . Děkuji za zavolání . Na shledanou .","Doufám , že jsem zodpověděla všechny vaše otázky . Děkuji za zavolání . Na shledanou ."
goodbye(),goodbye(),"Děkuji , na shledanou .","Děkuji , na shledanou ."
"inform(food=Italian,kids_allowed=yes,name='Švejk Restaurant',near='Old Town Square')","inform(food=X-food,kids_allowed=yes,name=X-name,near=X-near)","Mám tu další italskou restauraci , která je vhodná pro děti . Jmenuje se Restaurace Švejk a je blízko Staroměstského náměstí .","Mám tu další X-food restauraci , která je vhodná pro děti . Jmenuje se X-name a je blízko X-near ."
?request(price_range),?request(price_range),Jakou cenovou kategorii byste hledali ?,Jakou cenovou kategorii byste hledali ?
"inform(count=2,food=Czech,price_range=cheap,type=restaurant)","inform(count=X-count,food=X-food,price_range=X-price_range,type=restaurant)","Vím o dalších 2 restauracích , které nabízí levné české jídlo .","Vím o dalších X-count restauracích , které nabízí X-price_range X-food jídlo ."
goodbye(),goodbye(),Dobrou chuť !,Dobrou chuť !
?request(price_range),?request(price_range),Jakou cenovou kategorii si přejete ?,Jakou cenovou kategorii si přejete ?
"inform(name=Místo,type=restaurant)","inform(name=X-name,type=restaurant)",Restaurace se jmenuje Místo .,Restaurace se jmenuje X-name .
"inform(address='Kaprova 25',name='U Konšelů')","inform(address=X-address,name=X-name)",Adresa do restaurace U Konšelů je Kaprova 25,Adresa do restaurace X-name je X-address
goodbye(),goodbye(),Děkuji za zavolání .,Děkuji za zavolání .
"inform(kids_allowed=yes,name='Pivo & Basilico',price_range=expensive)","inform(kids_allowed=yes,name=X-name,price_range=X-price_range)","Pivo & Basilico je drahá restaurace , která je vhodná pro návštěvu s dětmi .","X-name je X-price_range restaurace , která je vhodná pro návštěvu s dětmi ."
"inform(count=77,kids_allowed=no,price_range=moderate,type=restaurant)","inform(count=X-count,kids_allowed=no,price_range=X-price_range,type=restaurant)","Našla jsem 77 restaurací ve střední cenové skupině , kde není povolen vstup s dětmi .","Našla jsem X-count restaurací ve X-price_range cenové skupině , kde není povolen vstup s dětmi ."
?request(price_range),?request(price_range),Jakou cenovou kategorii hledáte ?,Jakou cenovou kategorii hledáte ?
"inform(count=4,food=vegetarian,price_range=expensive,type=restaurant)","inform(count=X-count,food=X-food,price_range=X-price_range,type=restaurant)",V nabídce jsou 4 vegetariánské restaurace v drahé cenové kategorii .,V nabídce jsou X-count X-food restaurace v X-price_range cenové kategorii .
"inform(food=American,good_for_meal=lunch,kids_allowed=yes,name='U Konšelů',price_range=cheap)","inform(food=X-food,good_for_meal=X-good_for_meal,kids_allowed=yes,name=X-name,price_range=X-price_range)","U Konšelů se hodí na oběd , patří do levné cenové skupiny a je vstřícné k dětem , kuchyně je americká .","X-name se hodí na X-good_for_meal , patří do X-price_range cenové skupiny a je vstřícné k dětem , kuchyně je X-food ."
?request(good_for_meal),?request(good_for_meal),"Hledáte restauraci podávající snídaně , obědy , nebo večeře ?","Hledáte restauraci podávající snídaně , obědy , nebo večeře ?"
"inform_no_match(good_for_meal=breakfast,price_range=expensive)","inform_no_match(good_for_meal=X-good_for_meal,price_range=X-price_range)",Ve vyšší cenové kategorii se tu nenacházejí žádné restaurace podávající snídaně .,Ve X-price_range cenové kategorii se tu nenacházejí žádné restaurace podávající X-good_for_meal .
goodbye(),goodbye(),Děkuji . Zase někdy na shledanou .,Děkuji . Zase někdy na shledanou .
goodbye(),goodbye(),Děkuji . Někdy na shledanou .,Děkuji . Někdy na shledanou .
?select(kids_allowed='yes or no'),?select(kids_allowed='yes or no'),Chcete najít restauraci přístupnou nebo nepřístupnou dětem ?,Chcete najít restauraci přístupnou nebo nepřístupnou dětem ?
goodbye(),goodbye(),Na shledanou !,Na shledanou !
?select(kids_allowed='yes or no'),?select(kids_allowed='yes or no'),"Promiňte , chcete restauraci , která je vhodná pro děti nebo vám na tom nezáleží ?","Promiňte , chcete restauraci , která je vhodná pro děti nebo vám na tom nezáleží ?"
"inform_only_match(food=Turkish,name='U Konšelů')","inform_only_match(food=X-food,name=X-name)","S výjimkou restaurace U Konšelů tu nemám žádnou jinou , kde by podávali turecké jídlo .","S výjimkou restaurace X-name tu nemám žádnou jinou , kde by podávali X-food jídlo ."
"inform(area='Malá Strana',name=BarBar)","inform(area=X-area,name=X-name)",Restaurace BarBar je na Malé Straně .,Restaurace X-name je na X-area .
"inform(food=American,name='Kočár z Vídně',near='Petřín Tower')","inform(food=X-food,name=X-name,near=X-near)",Kočár z Vídně se nachází blízko Petřínské rozhledny a podávají zde americká jídla .,X-name se nachází blízko X-near a podávají zde X-food jídla .
"inform(food=Asian,name='Pivo & Basilico')","inform(food=X-food,name=X-name)",Pivo & Basilico je příjemná restaurace s asijskou kuchyní .,X-name je příjemná restaurace s X-food kuchyní .
"inform(food=vegetarian,kids_allowed=yes,name='Švejk Restaurant',price_range=cheap)","inform(food=X-food,kids_allowed=yes,name=X-name,price_range=X-price_range)","Restaurace Švejk je levná vegetariánské restaurace , která se hodí pro děti .","X-name je X-price_range X-food restaurace , která se hodí pro děti ."
?select(kids_allowed='yes or no'),?select(kids_allowed='yes or no'),"Zajímá Vás , zda do restaurace mohou děti ?","Zajímá Vás , zda do restaurace mohou děti ?"
goodbye(),goodbye(),"Děkuji Vám , mějte se krásně .","Děkuji Vám , mějte se krásně ."
"inform(kids_allowed=no,name='Švejk Restaurant',price_range=moderate)","inform(kids_allowed=no,name=X-name,price_range=X-price_range)",Restaurace Švejk je středně drahá a není zde povolen vstup s dětmi .,X-name je X-price_range a není zde povolen vstup s dětmi .
?request(good_for_meal),?request(good_for_meal),"Promiňte , chcete snídani , pozdní snídani , oběd nebo večeři ?","Promiňte , chcete snídani , pozdní snídani , oběd nebo večeři ?"
"inform(name='Café Kampus',type=restaurant)","inform(name=X-name,type=restaurant)",Café Kampus je příjemný podnik .,X-name je příjemný podnik .
goodbye(),goodbye(),"Děkuju Vám , na shledanou .","Děkuju Vám , na shledanou ."
"inform(name='U Konšelů',type=restaurant)","inform(name=X-name,type=restaurant)",Je tu pěkná restaurace jménem U Konšelů .,Je tu pěkná restaurace jménem X-name .
"inform(count=233,good_for_meal=dinner,type=restaurant)","inform(count=X-count,good_for_meal=X-good_for_meal,type=restaurant)",233 restaurací podává večeře .,X-count restaurací podává X-good_for_meal .
"inform_only_match(good_for_meal=lunch,kids_allowed=yes,name='U Tučňáků',near='Wenceslas Square')","inform_only_match(good_for_meal=X-good_for_meal,kids_allowed=yes,name=X-name,near=X-near)","Jediná restaurace , kterou jsem našla , aby byla vhodná pro děti , byla poblíž Václavského náměstí a měla dobré obědy , je restaurace U Tučňáků .","Jediná restaurace , kterou jsem našla , aby byla vhodná pro děti , byla poblíž X-near a měla dobré X-good_for_meal , je restaurace X-name ."
"inform(area=Nusle,name='Café Savoy')","inform(area=X-area,name=X-name)",Café Savoy se nachází v Nuslích,X-name se nachází v X-area
goodbye(),goodbye(),"Děkuji , na shledanou .","Děkuji , na shledanou ."
"inform(name='Kočár z Vídně',type=restaurant)","inform(name=X-name,type=restaurant)",Jmenuje se Kočár z Vídně a je to krásná restaurace .,Jmenuje se X-name a je to krásná restaurace .
